"ID","Banco","Titular_Noticia","Mode(Titular_Noticia_SplitResultList_replaced)"
1,"Galicia","Banco Galicia concreta la compra de la operacion local del HSBC en Argentina","Positivo"
2,"Santander","Santander sufre un hackeo global que expone datos de millones de clientes y empleados","Negativo"
3,"BBVA","BBVA gana un 38% mas en el primer trimestre impulsado por sus filiales de Mexico y España","Positivo"
5,"BBVA","La CNMV de España investiga a BBVA por supuestas irregularidades en contrataciones del pasado","Negativo"
8,"Macro","Banco Macro reporta un incremento en el ratio de morosidad de su cartera de consumo minorista","Negativo"
9,"Santander","Standard & Poor's eleva la calificacion crediticia de Banco Santander a perspectiva estable","Positivo"
12,"Galicia","Usuarios reportan fallas masivas en la app de Galicia y home banking durante el dia de cobro","Negativo"
14,"BBVA","BBVA recibe una multa millonaria del Banco Central por fallas en los controles de lavado de dinero","Negativo"
